0,Kost Senopati SCBD 2 Kebayoran Baru Jakarta Selatan,Kebayoran Baru,"K. Mandi Dalam ·WiFi ·AC ·Kloset Duduk ·Kasur ·Akses 24 Jam
4.1",Rp1.800.000
1,Kost Apik Pondok Jaya VIII Tipe C Mampang Prapatan Jakarta Selatan,Mampang Prapatan,"WiFi ·Kloset Duduk ·Kasur ·Akses 24 Jam
4.5",Diskon 200rb sewa 3 bulan
2,Kost Singgahsini Kemang Timur Syariah Tipe B Mampang Prapatan Jakarta Selatan,Kecamatan Mampang Prapatan,"K. Mandi Dalam ·WiFi ·AC ·Kloset Duduk ·Kasur ·Akses 24 Jam
4.6",Rp1.325.000
3,Kost Apik Evy Kalibata Utara Tipe A Pancoran Jakarta Selatan,Pancoran,"K. Mandi Dalam ·WiFi ·Kasur ·Akses 24 Jam
4.9",Diskon 200rb sewa 3 bulan
4,Kost Singgahsini Richie Bangka Barat IV Tipe A Mampang Prapatan Jakarta Selatan,Mampang Prapatan,"K. Mandi Dalam ·WiFi ·AC ·Kloset Duduk ·Kasur ·Akses 24 Jam
4.9",Rp1.925.000
5,Kost Singgahsini Beranda Zen Tipe B Mampang Prapatan Jakarta Selatan,Kecamatan Mampang Prapatan,"K. Mandi Dalam ·WiFi ·AC ·Kloset Duduk ·Kasur ·Akses 24 Jam
4.8",Diskon 200rb sewa 3 bulan
6,Kost Singgahsini Tegal Parang Tipe B Mampang Prapatan Jakarta Selatan,Kecamatan Mampang Prapatan,"K. Mandi Dalam ·WiFi ·AC ·Kloset Duduk ·Kasur ·Akses 24 Jam
4.9",Rp1.375.000
7,Kost Singgahsini Nathan Kemang Utara Tipe B Mampang Prapatan Jakarta Selatan,Mampang Prapatan,"K. Mandi Dalam ·WiFi ·AC ·Kloset Duduk ·Kasur ·Akses 24 Jam
4.4",Diskon 250rb sewa 3 bulan
8,Kost Singgahsini Attahiriyah Pejaten Tipe A Pasar Minggu Jakarta Selatan,Pasar Minggu,"K. Mandi Dalam ·WiFi ·AC ·Kloset Duduk ·Kasur ·Akses 24 Jam
4.9",Rp2.225.000
9,Kost Singgahsini RR Mansion Tipe E Pancoran Jakarta Selatan,Pancoran,"K. Mandi Dalam ·WiFi ·AC ·Kloset Duduk ·Kasur ·Akses 24 Jam
5.0",Diskon 400rb sewa 3 bulan
10,Kost Singgahsini RR Mansion Tipe D Pancoran Jakarta Selatan,Pancoran,K. Mandi Dalam ·WiFi ·AC ·Kloset Duduk ·Kasur ·Akses 24 Jam,Rp3.735.000
11,Kost Singgahsini RR Mansion Tipe C Pancoran Jakarta Selatan,Pancoran,K. Mandi Dalam ·WiFi ·AC ·Kloset Duduk ·Kasur ·Akses 24 Jam,Diskon 250rb sewa 3 bulan
12,Kost Singgahsini RR Mansion Tipe B Pancoran Jakarta Selatan,Pancoran,K. Mandi Dalam ·WiFi ·AC ·Kloset Duduk ·Kasur ·Akses 24 Jam,Rp2.875.000
13,Kost Singgahsini Nathan Kemang Utara Tipe D Mampang Prapatan Jakarta Selatan,Mampang Prapatan,K. Mandi Dalam ·WiFi ·AC ·Kloset Duduk ·Kasur ·Akses 24 Jam,Rp2.725.000
14,Kost Singgahsini RR Mansion Tipe A Pancoran Jakarta Selatan,Pancoran,K. Mandi Dalam ·WiFi ·AC ·Kloset Duduk ·Kasur ·Akses 24 Jam,Rp1.930.000
15,Kost Singgahsini Nathan Kemang Utara Tipe A Mampang Prapatan Jakarta Selatan,Mampang Prapatan,K. Mandi Dalam ·WiFi ·AC ·Kloset Duduk ·Kasur ·Akses 24 Jam,Rp3.475.000
16,Kost Singgahsini Vit Tipe B Mampang Prapatan Jakarta Selatan,Mampang Prapatan,K. Mandi Dalam ·WiFi ·AC ·Kloset Duduk ·Kasur ·Akses 24 Jam,Rp3.725.000
17,Kost Singgahsini Kemang 6 Tipe C Mampang Prapatan Jakarta Selatan,Mampang Prapatan,K. Mandi Dalam ·WiFi ·AC ·Kloset Duduk ·Kasur ·Akses 24 Jam,Rp4.075.000
18,Kost Singgahsini White House Tipe B Mampang Prapatan Jakarta Selatan,Kecamatan Mampang Prapatan,"K. Mandi Dalam ·WiFi ·AC ·Kloset Duduk ·Kasur ·Akses 24 Jam
4.6",Rp4.275.000
19,Kost Apik Pondok Jaya VIII Tipe D Mampang Prapatan Jakarta Selatan,Mampang Prapatan,WiFi ·Kloset Duduk ·Kasur ·Akses 24 Jam,Rp3.275.000
20,Kost Harum 1 Tipe A Kebayoran Baru Jakarta Selatan,Kecamatan Kebayoran Baru,"Kasur ·Akses 24 Jam
5.0",Rp4.825.000
21,Kost Pak Rahmani Pancoran Jakarta Selatan,Pancoran,K. Mandi Dalam ·WiFi ·Kasur ·Akses 24 Jam,Rp3.225.000
22,Kost 37 Syariah Tipe B Pancoran Jakarta Selatan,Pancoran,"K. Mandi Dalam ·Kloset Duduk ·Kasur ·Akses 24 Jam
3.3",Rp3.625.000
23,Kost Ceria Sekali Tipe A Mampang Prapatan Jakarta Selatan,Mampang Prapatan,"K. Mandi Dalam ·WiFi ·Kasur ·Akses 24 Jam
1.0",Rp2.875.000
24,Kost Arfath Pancoran Jakarta Selatan,Pancoran,K. Mandi Dalam ·WiFi ·AC ·Kloset Duduk ·Kasur ·Akses 24 Jam,Ngekos di SS SatSet Gak Macet
25,Kost Whites Tipe C Pancoran Jakarta Selatan,Kecamatan Pancoran,K. Mandi Dalam ·WiFi ·AC ·Kloset Duduk ·Kasur ·Akses 24 Jam,Rp2.805.000
26,Kost House Of Bless Tipe A Mampang Prapatan Jakarta Selatan,Kecamatan Mampang Prapatan,K. Mandi Dalam ·WiFi ·AC ·Kasur,Rp1.650.000
27,Kost Owen Tipe A Pancoran Jakarta Selatan,Pancoran,K. Mandi Dalam ·WiFi ·AC ·Kloset Duduk ·Kasur,Rp650.000
28,Kost Jabu Hasian Cipete Lt 2 Cilandak Jakarta Selatan,Kecamatan Cilandak,AC ·Kloset Duduk ·Kasur ·Akses 24 Jam,Rp1.100.000
29,Kost Soffiyan Mampang Prapatan Jakarta Selatan,Kecamatan Mampang Prapatan,K. Mandi Dalam ·WiFi ·AC ·Kasur ·Akses 24 Jam,Rp1.300.000
30,Kost Verdita I Cilandak Jakarta Selatan,Kecamatan Cilandak,K. Mandi Dalam ·WiFi ·AC ·Kloset Duduk ·Kasur ·Akses 24 Jam,Rp1.500.000
31,Kost A&R Residence Tipe C Kebayoran Baru Jakarta Selatan,Kecamatan Kebayoran Baru,K. Mandi Dalam ·WiFi ·AC ·Kloset Duduk ·Kasur ·Akses 24 Jam,Rp1.500.000
32,Kost Jalan Duren Tiga Raya Pancoran Jakarta Selatan,Pancoran,K. Mandi Dalam ·Kloset Duduk ·Kasur ·Akses 24 Jam,Rp2.500.000
33,Kost Duren Tiga 5 Pancoran Jakarta Selatan,Pancoran,Kasur,Rp2.750.000
34,Kost Samidi Jalan Bangka Mampang Prapatan Jakarta Selatan,Mampang Prapatan,Kloset Duduk ·Kasur,Rp2.400.000
35,Kost Kembar Mampang Prapatan Jakarta Selatan,Kecamatan Mampang Prapatan,K. Mandi Dalam ·WiFi ·AC ·Kloset Duduk ·Kasur ·Akses 24 Jam,Rp3.500.000
36,Kost Pancoran Barat 2B Pancoran Jakarta Selatan,Pancoran,K. Mandi Dalam ·WiFi ·Kasur ·Akses 24 Jam,Rp1.500.000
37,Kost Bangka BnB Tipe A Mampang Prapatan Jakarta Selatan,Mampang Prapatan,K. Mandi Dalam ·WiFi ·AC ·Kloset Duduk ·Kasur,Rp3.000.000
38,Kost Rumah Pak Jendral VIP Kebayoran Baru Jakarta Selatan,Kebayoran Baru,WiFi ·AC ·Kloset Duduk ·Kasur ·Akses 24 Jam,Rp3.500.000
39,Kost Pulo Raya Kebayoran Baru Jakarta Selatan,Kebayoran Baru,"K. Mandi Dalam ·WiFi ·AC ·Kloset Duduk ·Kasur ·Akses 24 Jam
4.8",Rp1.200.000
40,Kost Griya TAS Standar Mampang Prapatan Jakarta Selatan,Mampang Prapatan,K. Mandi Dalam ·WiFi ·AC ·Kloset Duduk ·Kasur,Rp750.000
41,Kost Sweet Home 1 Tipe G1 Pancoran Jakarta Selatan,Pancoran,WiFi ·Kasur,Rp1.100.000
42,Kost Sweet Home 1 Tipe G2 Pancoran Jakarta Selatan,Pancoran,WiFi ·Kasur,Rp1.500.000
43,Kost Double Eight Tipe A Pancoran Jakarta Selatan,Pancoran,WiFi ·AC ·Kloset Duduk ·Kasur,Rp1.100.000
44,Kost Zaldina Fajarani Tipe A Mampang Prapatan Jakarta Selatan,Mampang Prapatan,K. Mandi Dalam ·WiFi ·AC ·Kloset Duduk ·Kasur ·Akses 24 Jam,Rp3.500.000
45,Kost Amel Mampang Prapatan Jakarta Selatan,Mampang Prapatan,K. Mandi Dalam,Rp3.500.000
46,Kost D Arrasoe Tipe A Mampang Prapatan Jakarta Selatan,Mampang Prapatan,"K. Mandi Dalam ·WiFi ·AC ·Kloset Duduk ·Kasur ·Akses 24 Jam
3.9",Rp2.800.000
47,Kost Giri Enam Home Twin Bed Kebayoran Baru Jakarta Selatan,Kecamatan Kebayoran Baru,K. Mandi Dalam ·WiFi ·AC ·Kloset Duduk ·Kasur ·Akses 24 Jam,Rp2.600.000
48,Kost Giri Enam Home Single Bed Window Lt 3 Kebayoran Baru Jakarta Selatan,Kecamatan Kebayoran Baru,K. Mandi Dalam ·WiFi ·AC ·Kloset Duduk ·Kasur ·Akses 24 Jam,Rp1.200.000
49,Kost Mumtaz 1 Mampang Prapatan Jakarta Selatan,Mampang Prapatan,K. Mandi Dalam ·WiFi ·Kasur,Rp1.000.000
50,Kost Cemara Mampang Prapatan Jakarta Selatan,Mampang Prapatan,K. Mandi Dalam ·WiFi ·AC ·Kloset Duduk ·Kasur ·Akses 24 Jam,Rp1.600.000
51,Kost Mampang Residence 94 Mampang Prapatan Jakarta Selatan,Mampang Prapatan,"K. Mandi Dalam ·WiFi ·AC ·Kloset Duduk ·Kasur ·Akses 24 Jam
4.9",Rp1.800.000
52,Kost 37 Syariah Tipe A Pancoran Jakarta Selatan,Kecamatan Pancoran,"K. Mandi Dalam ·WiFi ·AC ·Kloset Duduk ·Kasur ·Akses 24 Jam
5.0",Rp1.200.000
53,Kost Ceria Sekali Tipe B Mampang Prapatan Jakarta Selatan,Mampang Prapatan,K. Mandi Dalam ·WiFi ·AC ·Kloset Duduk ·Kasur,Rp1.800.000
54,Kost Bapak Revi Mampang Prapatan Jakarta Selatan,Mampang Prapatan,WiFi ·Kloset Duduk ·Kasur ·Akses 24 Jam,Rp2.650.000
55,Kost Ekslusif Edomora Residence Kebayoran Baru Jakarta Selatan,Kecamatan Kebayoran Baru,"K. Mandi Dalam ·WiFi ·AC ·Kloset Duduk ·Kasur ·Akses 24 Jam
5.0",Rp2.485.000
56,Rumah Kontrakan Achmad Saepudin Mampang Prapatan Jakarta Selatan,Kecamatan Mampang Prapatan,K. Mandi Dalam ·WiFi ·AC ·Kasur ·Akses 24 Jam,Rp1.050.000
57,Kost Tendean C3 Mampang Prapatan Jakarta Selatan,Kecamatan Mampang Prapatan,K. Mandi Dalam ·WiFi ·AC ·Kloset Duduk ·Kasur,Rp2.000.000
58,Kost Adimas Tipe B Mampang Prapatan Jakarta Selatan,Kecamatan Mampang Prapatan,"Kasur ·Akses 24 Jam
4.6",Rp2.900.000
59,Kost A&R Residence Tipe B Kebayoran Baru Jakarta Selatan,Kecamatan Kebayoran Baru,K. Mandi Dalam ·WiFi ·AC ·Kloset Duduk ·Kasur ·Akses 24 Jam,Rp2.000.000
60,Kost A&R Residence Tipe A Kebayoran Baru Jakarta Selatan,Kecamatan Kebayoran Baru,K. Mandi Dalam ·WiFi ·AC ·Kloset Duduk ·Akses 24 Jam,Rp1.500.000
61,Kost Hj Ros Tipe B Pancoran Jakarta Selatan,Kecamatan Pancoran,K. Mandi Dalam ·WiFi ·AC ·Kloset Duduk ·Kasur,Rp1.400.000
62,Kost Moses Mampang Prapatan Jakarta Selatan,Mampang Prapatan,"K. Mandi Dalam ·WiFi ·AC ·Kloset Duduk ·Kasur ·Akses 24 Jam
5.0",Rp3.600.000
63,Kost Duren Tiga Tipe D Pancoran Jakarta Selatan,Pancoran,K. Mandi Dalam ·WiFi ·AC ·Kloset Duduk ·Kasur ·Akses 24 Jam,promo 2024
64,Kost Yustin Tipe F Pancoran Jakarta Selatan,Pancoran,K. Mandi Dalam ·WiFi ·AC ·Kloset Duduk ·Kasur ·Akses 24 Jam,Rp1.400.000
65,Kost Duren Tiga Tipe B Pancoran Jakarta Selatan,Pancoran,K. Mandi Dalam ·WiFi ·Kloset Duduk ·Kasur ·Akses 24 Jam,Rp4.300.000
66,Kost Murah Pasar Santa Kebayoran Baru Jakarta Selatan,Kecamatan Kebayoran Baru,K. Mandi Dalam ·AC ·Kloset Duduk ·Kasur ·Akses 24 Jam,Rp800.000
67,Kost Zarus 1 Mampang Prapatan Jakarta Selatan,Mampang Prapatan,K. Mandi Dalam ·WiFi ·Kloset Duduk ·Kasur ·Akses 24 Jam,Rp4.000.000
68,Kost Jasmine Tipe A Pancoran Jakarta Selatan,Pancoran,K. Mandi Dalam ·Kasur ·Akses 24 Jam,Rp4.500.000
69,Kost Wisma Kaesang Tipe A Mampang Prapatan Jakarta Selatan,Mampang Prapatan,"K. Mandi Dalam ·WiFi ·AC ·Kloset Duduk ·Kasur ·Akses 24 Jam
3.1",Rp2.400.000
70,Kost Achmad Saepudin I Tipe A Mampang Prapatan Jakarta Selatan,Kecamatan Mampang Prapatan,Akses 24 Jam,Rp1.800.000
71,Kost Rengas 2 Kebayoran Baru Jakarta Selatan,Kebayoran Baru,"K. Mandi Dalam ·WiFi ·Kasur
5.0",Rp2.100.000
72,Kost Infinite Residence Mampang Prapatan Jakarta Selatan,Mampang Prapatan,K. Mandi Dalam ·WiFi ·AC ·Kloset Duduk ·Kasur ·Akses 24 Jam,Rp2.500.000
73,Kost Kalibata Tipe 1 Pancoran Jakarta Selatan,Kecamatan Pancoran,K. Mandi Dalam ·WiFi ·AC ·Kloset Duduk ·Kasur ·Akses 24 Jam,Rp1.250.000
74,Kost Haji Edi Mampang Prapatan Jakarta Selatan,Kecamatan Mampang Prapatan,K. Mandi Dalam ·WiFi ·Kasur ·Akses 24 Jam,Rp1.800.000
75,Kost Amanina Tipe B Pancoran Jakarta Selatan,Pancoran,"K. Mandi Dalam ·WiFi ·Kloset Duduk ·Kasur
1.3",Rp1.300.000
76,Kost 55 Kalibata Tipe C Pancoran Jakarta Selatan,Kecamatan Pancoran,K. Mandi Dalam ·WiFi ·AC ·Kloset Duduk ·Kasur,Rp1.400.000
77,Kost 55 Kalibata Tipe B Pancoran Jakarta Selatan,Kecamatan Pancoran,"K. Mandi Dalam ·WiFi ·AC ·Kloset Duduk ·Kasur
3.6",Rp1.700.000
78,Kost Akanaka Residence Mampang Prapatan Jakarta Selatan,Mampang Prapatan,K. Mandi Dalam ·WiFi ·AC ·Kloset Duduk ·Kasur,Rp750.000
79,Kost Abdul Majid Urban Residence Deluxe Kebayoran Baru Jakarta Selatan,Kebayoran Baru,K. Mandi Dalam ·WiFi ·AC ·Kloset Duduk ·Kasur ·Akses 24 Jam,Rp1.200.000
80,Kost Giri Enam Home King Bed Balcony Lt 2 Kebayoran Baru Jakarta Selatan,Kecamatan Kebayoran Baru,K. Mandi Dalam ·WiFi ·AC ·Kloset Duduk ·Kasur ·Akses 24 Jam,Rp4.000.000
81,Kost Giri Enam Home King Bed Balkon Lt 3 Kebayoran Baru Jakarta Selatan,Kecamatan Kebayoran Baru,K. Mandi Dalam ·WiFi ·AC ·Kloset Duduk ·Kasur ·Akses 24 Jam,Rp1.800.000
82,Kost Ayuni Pancoran Jakarta Selatan,Pancoran,"K. Mandi Dalam ·WiFi ·AC ·Kloset Duduk ·Kasur
5.0",Rp1.300.000
83,Kost H Studio Mampang Prapatan Jakarta Selatan,Kecamatan Mampang Prapatan,K. Mandi Dalam ·WiFi ·AC ·Kloset Duduk ·Kasur ·Akses 24 Jam,Rp1.800.000
84,Kost Mampang 55 Tipe A Mampang Prapatan Jakarta Selatan,Kecamatan Mampang Prapatan,K. Mandi Dalam ·Kloset Duduk ·Kasur,Rp3.000.000
85,Kost Furqon Tipe AC Kemang Mampang Prapatan Jakarta Selatan,Mampang Prapatan,K. Mandi Dalam ·WiFi ·AC ·Kloset Duduk ·Kasur ·Akses 24 Jam,Rp3.000.000
86,Kost Yanda Bunda Residence Tipe C Single Bed Mampang Prapatan Jakarta Selatan,Mampang Prapatan,WiFi ·AC ·Kloset Duduk ·Kasur ·Akses 24 Jam,Rp5.000.000
87,Kost Mawar 1 Mampang Prapatan Jakarta Selatan,Mampang Prapatan,K. Mandi Dalam ·Kasur ·Akses 24 Jam,Rp5.200.000
88,Kost Yanda Bunda Residence Tipe A Mampang Prapatan Jakarta Selatan,Mampang Prapatan,K. Mandi Dalam ·WiFi ·AC ·Kloset Duduk ·Kasur ·Akses 24 Jam,Rp3.260.000
89,Kost Kebalen Tipe B Kebayoran Baru Jakarta Selatan,Kebayoran Baru,K. Mandi Dalam ·WiFi ·AC ·Kloset Duduk ·Kasur,Rp3.000.000
90,Kost Pancoran Barat IV C Eksklusif Pancoran Jakarta Selatan,Kecamatan Pancoran,WiFi ·AC ·Kloset Duduk ·Kasur ·Akses 24 Jam,Rp2.550.000
91,Kost Hj Dahlia 34 Mampang Prapatan Jakarta Selatan,Mampang Prapatan,"K. Mandi Dalam ·WiFi ·Kasur ·Akses 24 Jam
4.0",Rp5.200.000
92,Kost Zaini Tipe C Cilandak Jakarta Selatan,Cilandak,"K. Mandi Dalam ·WiFi ·AC ·Kloset Duduk ·Kasur ·Akses 24 Jam
4.0",Rp2.000.000
93,Kost Omah Tegal Parang Executive Mampang Prapatan Jakarta Selatan,Mampang Prapatan,"K. Mandi Dalam ·WiFi ·AC ·Kloset Duduk ·Kasur
4.9",Rp2.300.000
94,Kost Azzahra Tipe A Mampang Prapatan Jakarta Selatan,Mampang Prapatan,K. Mandi Dalam ·WiFi ·Kloset Duduk ·Kasur,Rp1.500.000
95,Kost Baru Bangka Raya Tipe B Mampang Prapatan Jakarta Selatan,Mampang Prapatan,"K. Mandi Dalam ·WiFi ·AC ·Kasur ·Akses 24 Jam
4.6",Rp1.000.000
96,Kost Sky Residence Mampang Prapatan Jakarta Selatan,Mampang Prapatan,K. Mandi Dalam ·WiFi ·AC ·Kloset Duduk ·Kasur ·Akses 24 Jam,Rp2.500.000
97,Kost Bakmi Jawa Mampang Prapatan Jakarta Selatan,Mampang Prapatan,K. Mandi Dalam ·WiFi ·AC ·Kloset Duduk ·Kasur ·Akses 24 Jam,Rp2.500.000
98,Kost Pak Andri Mampang Prapatan Jakarta Selatan,Mampang Prapatan,Kasur ·Akses 24 Jam,Rp1.700.000
99,Kost Mroom PH Kebayoran Baru Jakarta Selatan,Kecamatan Kebayoran Baru,"K. Mandi Dalam ·WiFi ·AC ·Kloset Duduk ·Kasur
4.5",Rp900.000
100,Kost Kebalen 1 Tipe C Kebayoran Baru Jakarta Selatan,Kebayoran Baru,Kloset Duduk ·Kasur ·Akses 24 Jam,Rp2.500.000
101,Kost Triloka Mansion Tipe A Pancoran Jakarta Selatan,Pancoran,"K. Mandi Dalam ·WiFi ·AC ·Kloset Duduk ·Kasur ·Akses 24 Jam
5.0",Rp2.250.000
102,Kost Java dekost Tipe A Duren Tiga Pancoran Jakarta Selatan,Pancoran,WiFi ·Kloset Duduk ·Kasur,Rp1.200.000
103,Kost Amy 36 Tipe C Mampang Prapatan Jakarta Selatan,Mampang Prapatan,K. Mandi Dalam ·WiFi ·AC ·Kloset Duduk ·Kasur ·Akses 24 Jam,Rp1.700.000
104,Kost Kemang Utara C Mampang Prapatan Jakarta Selatan,Kecamatan Mampang Prapatan,AC ·Kloset Duduk ·Kasur ·Akses 24 Jam,Rp2.495.000
105,Kost Daksa Pancoran Jakarta Selatan,Pancoran,"Kloset Duduk ·Kasur
4.6",Rp3.000.001
106,Kost H Deddy Tipe A Mampang Prapatan Jakarta Selatan,Kecamatan Mampang Prapatan,K. Mandi Dalam ·Kasur ·Akses 24 Jam,Rp750.000
107,Kost 3 Pav Pancoran Jakarta Selatan,Pancoran,K. Mandi Dalam ·WiFi ·AC ·Kloset Duduk ·Kasur ·Akses 24 Jam,Rp3.300.000
108,Kost Dahlia Pasar Minggu Jakarta Selatan,Pasar Minggu,K. Mandi Dalam ·WiFi ·Kasur ·Akses 24 Jam,Rp1.000.000
109,Kost Bengisel Tipe A Pancoran Jakarta Selatan,Pancoran,"WiFi ·Kloset Duduk ·Kasur ·Akses 24 Jam
4.5",Rp2.990.000
110,Kost Almuntaha Tipe Duluxe Mampang Prapatan Jakarta Selatan,Kecamatan Mampang Prapatan,"K. Mandi Dalam ·WiFi ·AC ·Kloset Duduk ·Kasur ·Akses 24 Jam
5.0",Rp1.200.000
111,Kost Triloka Mansion Tipe C Pancoran Jakarta Selatan,Pancoran,K. Mandi Dalam ·WiFi ·AC ·Kloset Duduk ·Kasur ·Akses 24 Jam,Rp2.450.000
112,Kost Nabils Mampang Prapatan Jakarta Selatan,Mampang Prapatan,K. Mandi Dalam ·WiFi ·AC ·Kloset Duduk ·Kasur,Rp1.300.000
113,Kost Nur 53 AC Mampang Prapatan Jakarta Selatan,Kecamatan Mampang Prapatan,"WiFi ·AC ·Kloset Duduk ·Kasur ·Akses 24 Jam
4.6",Rp1.150.000
114,Kost 88 Group Tipe A Pancoran Jakarta Selatan,Kecamatan Pancoran,K. Mandi Dalam ·WiFi ·AC ·Kloset Duduk ·Kasur ·Akses 24 Jam,Rp900.000
115,Kost Triloka Mansion Tipe B Pancoran Jakarta Selatan,Pancoran,"K. Mandi Dalam ·WiFi ·AC ·Kloset Duduk ·Kasur ·Akses 24 Jam
4.0",Rp2.000.000
116,Kost Happy Family Tipe A Mampang Prapatan Jakarta Selatan,Kecamatan Mampang Prapatan,"K. Mandi Dalam ·WiFi ·Kloset Duduk ·Kasur ·Akses 24 Jam
5.0",Rp900.000
117,Kost Bapak Fikri Tipe B Pancoran Jakarta Selatan,Pancoran,"K. Mandi Dalam ·WiFi ·Kasur
1.6",Rp1.000.000
118,Kost Bapak Fikri Tipe A Pancoran Jakarta Selatan,Pancoran,K. Mandi Dalam ·WiFi ·Kasur,Rp3.500.000
119,Kost Ummi Tipe A2 Mampang Prapatan Jakarta Selatan,Kecamatan Mampang Prapatan,K. Mandi Dalam ·WiFi ·AC ·Kloset Duduk ·Kasur ·Akses 24 Jam,Rp2.650.000
120,Kost Mroom Nipah Residence Tipe B Kebayoran Baru Jakarta Selatan,Kecamatan Kebayoran Baru,K. Mandi Dalam ·WiFi ·AC ·Kloset Duduk ·Kasur ·Akses 24 Jam,Rp1.700.000
121,Kost Ani 3 Pancoran Jakarta Selatan,Kecamatan Pancoran,K. Mandi Dalam ·WiFi ·AC ·Kasur ·Akses 24 Jam,Rp1.500.000
122,Kost Pondok VIP Mampang Prapatan Jakarta Selatan,Kecamatan Mampang Prapatan,K. Mandi Dalam ·WiFi ·AC ·Kloset Duduk ·Kasur ·Akses 24 Jam,Rp1.800.000
123,Kost Young Tipe B Pancoran Jakarta Selatan,Kecamatan Pancoran,K. Mandi Dalam ·WiFi ·AC ·Kloset Duduk ·Kasur,Rp2.840.000
124,Kost Omah Tentrem Wijaya Tipe Single Bed Kebayoran Baru Jakarta Selatan,Kebayoran Baru,K. Mandi Dalam ·WiFi ·AC ·Kloset Duduk ·Kasur,Rp1.300.000
125,Kost Chie 88 Mampang Prapatan Jakarta Selatan,Kecamatan Mampang Prapatan,K. Mandi Dalam ·Akses 24 Jam,Rp850.000
126,Kost Salamah Mampang Prapatan Jakarta Selatan,Mampang Prapatan,K. Mandi Dalam ·WiFi ·AC ·Kasur ·Akses 24 Jam,Rp750.000
127,Kost Ibu Ida RW Pancoran Jakarta Selatan,Kecamatan Pancoran,Kloset Duduk ·Kasur ·Akses 24 Jam,Rp1.800.000
128,Kost Pa Yudi 1 Mampang Prapatan Jakarta Selatan,Kecamatan Mampang Prapatan,K. Mandi Dalam ·WiFi ·AC ·Kloset Duduk ·Akses 24 Jam,Rp2.500.000
129,Kost Arraihan Mampang Prapatan Jakarta Selatan,Kecamatan Mampang Prapatan,Kasur ·Akses 24 Jam,Rp1.400.000
130,Kost Bangka Raya Tipe A Mampang Prapatan Jakarta Selatan,Mampang Prapatan,K. Mandi Dalam ·WiFi ·AC ·Kloset Duduk ·Kasur ·Akses 24 Jam,Rp2.000.000
131,Kost Mp Prapatan Mpok Iyah Mampang Prapatan Jakarta Selatan,Mampang Prapatan,K. Mandi Dalam ·Kloset Duduk,Rp1.850.000
132,Kost Bagus Pak Sobar Mampang Prapatan Jakarta Selatan,Mampang Prapatan,WiFi ·Kloset Duduk ·Kasur ·Akses 24 Jam,Rp2.900.000
133,Kost BG 2 Tipe B Pancoran Jakarta Selatan,Pancoran,K. Mandi Dalam ·WiFi ·AC ·Kasur ·Akses 24 Jam,Rp1.370.000
134,Kost Kapten Tendean Mampang Prapatan Jakarta Selatan,Mampang Prapatan,K. Mandi Dalam ·WiFi ·AC ·Kloset Duduk ·Kasur ·Akses 24 Jam,Rp1.400.000
135,Kost Haji Ayyub Tipe B Mampang Prapatan Jakarta Selatan,Kecamatan Mampang Prapatan,K. Mandi Dalam ·WiFi ·AC ·Kasur,Rp900.000
136,Kost Mandiri Satu Pancoran Jakarta Selatan,Kecamatan Pancoran,K. Mandi Dalam ·WiFi ·Kloset Duduk ·Kasur ·Akses 24 Jam,Rp1.600.000
137,Kost Mroom Nipah Residence Tipe A Kebayoran Baru Jakarta Selatan,Kecamatan Kebayoran Baru,K. Mandi Dalam ·WiFi ·AC ·Kloset Duduk ·Kasur ·Akses 24 Jam,Rp800.000
138,Kost Encuk Jalu Mampang Prapatan Jakarta Selatan,Kecamatan Mampang Prapatan,K. Mandi Dalam ·WiFi ·Kasur ·Akses 24 Jam,Rp2.350.000
139,Kost Bapak Abdul Wahab Tipe A Mampang Prapatan Jakarta Selatan,Kecamatan Mampang Prapatan,K. Mandi Dalam ·AC ·Kasur ·Akses 24 Jam,Rp800.000
140,Kost Zili Pancoran Jakarta Selatan,Pancoran,K. Mandi Dalam ·WiFi ·Kasur ·Akses 24 Jam,Rp850.000
141,Kost Kusuma Homestay Tipe A Mampang Prapatan Jakarta Selatan,Kecamatan Mampang Prapatan,K. Mandi Dalam ·WiFi ·AC ·Kloset Duduk ·Kasur,Rp1.500.000
142,Kost Pak Yahya Mampang Prapatan Jakarta Selatan,Kecamatan Mampang Prapatan,K. Mandi Dalam ·Kloset Duduk ·Kasur ·Akses 24 Jam,Rp1.900.000
143,Kost Kholili Mampang Prapatan Jakarta Selatan,Mampang Prapatan,K. Mandi Dalam ·WiFi ·Kloset Duduk ·Kasur ·Akses 24 Jam,Rp1.300.000
144,Kost Vera Norita Tipe A Pancoran Jakarta Selatan,Pancoran,K. Mandi Dalam ·WiFi ·AC ·Kasur,Rp950.000
145,Kost Andi Tipe A Pasar Minggu Jakarta Selatan,Pasar Minggu,K. Mandi Dalam ·Kloset Duduk,Rp2.700.000
146,Kost White Tipe B Mampang Prapatan Jakarta Selatan,Mampang Prapatan,K. Mandi Dalam ·WiFi ·Kloset Duduk ·Kasur ·Akses 24 Jam,Rp900.000
147,Kost Pak Choliq Tipe B Mampang Prapatan Jakarta Selatan,Kecamatan Mampang Prapatan,K. Mandi Dalam ·AC ·Kloset Duduk ·Kasur ·Akses 24 Jam,Rp1.200.000
148,Kost Ibu Fitri Mampang Prapatan Jakarta Selatan,Mampang Prapatan,K. Mandi Dalam ·Kasur ·Akses 24 Jam,Rp1.000.000
149,Kost Bang Bewok Tipe A Pancoran Jakarta Selatan,Kecamatan Pancoran,K. Mandi Dalam ·AC ·Kasur ·Akses 24 Jam,Rp3.750.000
150,Kost Sweet Home 1 Tipe D5 Pancoran Jakarta Selatan,Pancoran,K. Mandi Dalam ·AC ·Kasur ·Akses 24 Jam,Rp1.250.000
151,Kost Jazleen Tipe C Pancoran Jakarta Selatan,Pancoran,"WiFi ·Kloset Duduk ·Kasur
5.0",Rp1.200.000
152,Kost Sweet Home 1 Tipe E3 Pancoran Jakarta Selatan,Pancoran,K. Mandi Dalam ·AC ·Kasur ·Akses 24 Jam,Rp1.000.000
153,Kost Samali Tipe A Pasar Minggu Jakarta Selatan,Pasar Minggu,AC ·Kloset Duduk ·Akses 24 Jam,Rp1.500.000
154,Kost Edy Mampang Prapatan Jakarta Selatan,Kecamatan Mampang Prapatan,K. Mandi Dalam ·Kasur,Rp1.200.000
155,Kost Poncol Jaya Mampang Prapatan Jakarta Selatan,Mampang Prapatan,WiFi ·AC ·Kasur,Rp1.500.000
156,Kost Dewi Pancoran Jakarta Selatan,Pancoran,WiFi ·Kloset Duduk ·Kasur,Rp1.000.000
157,Kost Ibu Sudar Tipe A Mampang Prapatan Jakarta Selatan,Kecamatan Mampang Prapatan,WiFi ·AC ·Kloset Duduk ·Kasur,Rp1.200.000
158,Kost Pejaten Indah Pancoran Jakarta Selatan,Kecamatan Pancoran,"K. Mandi Dalam ·WiFi ·AC ·Kloset Duduk ·Kasur
5.0",Rp2.000.000
159,Kost Amiza Zulfi Mampang Prapatan Jakarta Selatan,Kecamatan Mampang Prapatan,"K. Mandi Dalam ·WiFi ·AC ·Kloset Duduk ·Kasur
3.9",Rp1.000.000
160,Kos faizah Pancoran Jakarta Selatan,Pancoran,K. Mandi Dalam ·WiFi ·AC ·Kloset Duduk ·Kasur ·Akses 24 Jam,Rp2.000.000
161,Kost Cipete 15 Cilandak Jakarta Selatan,Cilandak,K. Mandi Dalam ·WiFi ·AC ·Kloset Duduk ·Kasur,Rp1.500.000
162,Kost Aalaya 1 Mampang Prapatan Jakarta Selatan,Mampang Prapatan,K. Mandi Dalam ·WiFi ·AC ·Kloset Duduk ·Akses 24 Jam,Rp1.225.000
163,Kost Bangka BnB Tipe B Mampang Prapatan Jakarta Selatan,Kecamatan Mampang Prapatan,K. Mandi Dalam ·WiFi ·AC ·Kasur ·Akses 24 Jam,Rp1.700.000
164,Kost Ibu Romlah Mampang Prapatan Jakarta Selatan,Mampang Prapatan,K. Mandi Dalam ·Kasur ·Akses 24 Jam,Rp1.050.000
165,Kost Ibu DS Tipe C Mampang Prapatan Jakarta Selatan,Kecamatan Mampang Prapatan,WiFi ·Kasur,Rp2.000.000
166,Kost Ibu Indah Executive Pancoran Jakarta Selatan,Pancoran,K. Mandi Dalam ·WiFi ·AC ·Kloset Duduk ·Kasur ·Akses 24 Jam,Rp2.000.000
167,Kost Dedy Tipe A Pancoran Jakarta Selatan,Kecamatan Pancoran,K. Mandi Dalam ·Kloset Duduk ·Kasur,Rp1.500.000
168,Kost Rumah Amel Tipe AC Pasar Minggu Jakarta Selatan,Pasar Minggu,K. Mandi Dalam ·WiFi ·AC ·Kasur ·Akses 24 Jam,Rp1.500.000
169,Kost Dizmizz Kebayoran Baru Jakarta Selatan,Kecamatan Kebayoran Baru,WiFi ·Kloset Duduk ·Kasur ·Akses 24 Jam,Rp2.500.000
170,Kost Kebalen 1 Tipe A Kebayoran Baru Jakarta Selatan,Kebayoran Baru,K. Mandi Dalam ·AC ·Kloset Duduk ·Kasur ·Akses 24 Jam,Rp3.000.000
171,Kost Darmani Kebayoran Baru Jakarta Selatan,Kebayoran Baru,K. Mandi Dalam ·WiFi ·Kasur,Rp3.750.000
172,Kost Rumah Amel Executive Pasar Minggu Jakarta Selatan,Pasar Minggu,K. Mandi Dalam ·WiFi ·AC ·Kasur ·Akses 24 Jam,Rp900.000
173,Kost Barakah Dua Mampang Prapatan Jakarta Selatan,Kecamatan Mampang Prapatan,K. Mandi Dalam ·AC ·Kasur,Rp900.000
174,Kost Rumah Soea Tipe B Pancoran Jakarta Selatan,Pancoran,K. Mandi Dalam ·WiFi ·AC ·Kloset Duduk ·Kasur ·Akses 24 Jam,Rp1.650.000
175,Kost Omah Tentrem Wijaya Twin Bed Kebayoran Baru Jakarta Selatan,Kecamatan Kebayoran Baru,K. Mandi Dalam ·WiFi ·AC ·Kloset Duduk ·Kasur,Rp850.000
176,Kost Bu Novi Tipe A Mampang Prapatan Jakarta Selatan,Kecamatan Mampang Prapatan,Kasur ·Akses 24 Jam,Rp1.500.000
177,Kost River 8 Tipe A Pancoran Jakarta Selatan,Pancoran,K. Mandi Dalam ·WiFi ·AC ·Kloset Duduk ·Kasur ·Akses 24 Jam,Rp1.100.000
178,Kost Griyakoe Tipe A Pancoran Jakarta Selatan,Kecamatan Pancoran,K. Mandi Dalam ·WiFi ·AC ·Kloset Duduk ·Kasur ·Akses 24 Jam,Rp2.200.000
179,Kost Warung Buncit Mampang Prapatan Jakarta Selatan,Mampang Prapatan,K. Mandi Dalam ·Kasur ·Akses 24 Jam,Rp1.100.000
180,Kost Barakah Mampang Prapatan Jakarta Selatan,Mampang Prapatan,K. Mandi Dalam ·Kasur,Rp2.250.000
181,Kost Barakah 3 Pancoran Jakarta Selatan,Kecamatan Pancoran,AC ·Kasur,Rp1.300.000
182,Kost Ananda Harian Pancoran Jakarta Selatan,Kecamatan Pancoran,K. Mandi Dalam ·WiFi ·AC ·Kloset Duduk ·Kasur ·Akses 24 Jam,Rp3.600.000
183,Kost Karyawati Mampang Prapatan Jakarta Selatan,Kecamatan Mampang Prapatan,Kloset Duduk ·Kasur ·Akses 24 Jam,Rp3.800.000
184,Kost Ibu Karino Mampang Prapatan Jakarta Selatan,Mampang Prapatan,Kloset Duduk ·Kasur,Rp730.000
185,Kost Cahaya Pancoran Jakarta Selatan,Kecamatan Pancoran,Kasur,Rp1.750.000
186,Kost Sisca Amalia Oktaviani Tegal Parang Mampang Prapatan Jakarta Selatan,Kecamatan Mampang Prapatan,K. Mandi Dalam ·WiFi ·AC ·Kloset Duduk ·Kasur ·Akses 24 Jam,Rp3.000.000
187,Kost Al Barokah Pondok Jaya X Tipe C Kramat jati Jakarta Selatan,Mampang Prapatan,K. Mandi Dalam ·WiFi ·AC ·Kloset Duduk ·Kasur ·Akses 24 Jam,Rp1.000.000
188,Kost Padang Setyo Tipe A Mampang Prapatan Jakarta Selatan,Mampang Prapatan,K. Mandi Dalam ·Kasur ·Akses 24 Jam,Rp900.000
