578,Kost Happy Family Tipe A Mampang Prapatan Jakarta Selatan,Kecamatan Mampang Prapatan,"K. Mandi Dalam ·WiFi ·Kloset Duduk ·Kasur ·Akses 24 Jam
5.0",Rp2.990.000
579,Kost Bapak Fikri Tipe B Pancoran Jakarta Selatan,Pancoran,"K. Mandi Dalam ·WiFi ·Kasur
1.6",Rp1.200.000
580,Kost 37 Syariah Tipe A Pancoran Jakarta Selatan,Kecamatan Pancoran,"K. Mandi Dalam ·WiFi ·AC ·Kloset Duduk ·Kasur ·Akses 24 Jam
5.0",Rp2.450.000
581,Kost Ceria Sekali Tipe B Mampang Prapatan Jakarta Selatan,Mampang Prapatan,K. Mandi Dalam ·WiFi ·AC ·Kloset Duduk ·Kasur,Rp1.300.000
582,Kost Bapak Revi Mampang Prapatan Jakarta Selatan,Mampang Prapatan,WiFi ·Kloset Duduk ·Kasur ·Akses 24 Jam,Rp1.150.000
583,Kost Ekslusif Edomora Residence Kebayoran Baru Jakarta Selatan,Kecamatan Kebayoran Baru,"K. Mandi Dalam ·WiFi ·AC ·Kloset Duduk ·Kasur ·Akses 24 Jam
5.0",Rp900.000
584,Rumah Kontrakan Achmad Saepudin Mampang Prapatan Jakarta Selatan,Kecamatan Mampang Prapatan,K. Mandi Dalam ·WiFi ·AC ·Kasur ·Akses 24 Jam,Rp2.000.000
585,Kost Tendean C3 Mampang Prapatan Jakarta Selatan,Kecamatan Mampang Prapatan,K. Mandi Dalam ·WiFi ·AC ·Kloset Duduk ·Kasur,Rp900.000
586,Kost Adimas Tipe B Mampang Prapatan Jakarta Selatan,Kecamatan Mampang Prapatan,"Kasur ·Akses 24 Jam
4.6",Rp1.000.000
587,Kost A&R Residence Tipe B Kebayoran Baru Jakarta Selatan,Kecamatan Kebayoran Baru,K. Mandi Dalam ·WiFi ·AC ·Kloset Duduk ·Kasur ·Akses 24 Jam,Rp3.500.000
588,Kost A&R Residence Tipe A Kebayoran Baru Jakarta Selatan,Kecamatan Kebayoran Baru,K. Mandi Dalam ·WiFi ·AC ·Kloset Duduk ·Akses 24 Jam,Rp2.650.000
589,Kost Hj Ros Tipe B Pancoran Jakarta Selatan,Kecamatan Pancoran,K. Mandi Dalam ·WiFi ·AC ·Kloset Duduk ·Kasur,Rp1.700.000
590,Kost Moses Mampang Prapatan Jakarta Selatan,Mampang Prapatan,"K. Mandi Dalam ·WiFi ·AC ·Kloset Duduk ·Kasur ·Akses 24 Jam
5.0",Rp1.500.000
591,Kost Duren Tiga Tipe D Pancoran Jakarta Selatan,Pancoran,K. Mandi Dalam ·WiFi ·AC ·Kloset Duduk ·Kasur ·Akses 24 Jam,Rp1.800.000
592,Kost Yustin Tipe F Pancoran Jakarta Selatan,Pancoran,K. Mandi Dalam ·WiFi ·AC ·Kloset Duduk ·Kasur ·Akses 24 Jam,Rp2.840.000
593,Kost Duren Tiga Tipe B Pancoran Jakarta Selatan,Pancoran,K. Mandi Dalam ·WiFi ·Kloset Duduk ·Kasur ·Akses 24 Jam,Rp1.300.000
594,Kost Murah Pasar Santa Kebayoran Baru Jakarta Selatan,Kecamatan Kebayoran Baru,K. Mandi Dalam ·AC ·Kloset Duduk ·Kasur ·Akses 24 Jam,Rp850.000
595,Kost Zarus 1 Mampang Prapatan Jakarta Selatan,Mampang Prapatan,K. Mandi Dalam ·WiFi ·Kloset Duduk ·Kasur ·Akses 24 Jam,Rp2.000.000
596,Kost Jasmine Tipe A Pancoran Jakarta Selatan,Pancoran,K. Mandi Dalam ·Kasur ·Akses 24 Jam,Rp1.500.000
597,Kost Wisma Kaesang Tipe A Mampang Prapatan Jakarta Selatan,Mampang Prapatan,"K. Mandi Dalam ·WiFi ·AC ·Kloset Duduk ·Kasur ·Akses 24 Jam
3.1",Rp1.400.000
598,Kost Achmad Saepudin I Tipe A Mampang Prapatan Jakarta Selatan,Kecamatan Mampang Prapatan,Akses 24 Jam,Rp3.600.000
599,Kost Rengas 2 Kebayoran Baru Jakarta Selatan,Kebayoran Baru,"K. Mandi Dalam ·WiFi ·Kasur
5.0",promo 2024
600,Kost Hj Ros Tipe B Pancoran Jakarta Selatan,Kecamatan Pancoran,K. Mandi Dalam ·WiFi ·AC ·Kloset Duduk ·Kasur,Rp1.400.000
601,Kost Moses Mampang Prapatan Jakarta Selatan,Mampang Prapatan,"K. Mandi Dalam ·WiFi ·AC ·Kloset Duduk ·Kasur ·Akses 24 Jam
5.0",Rp4.300.000
602,Kost Duren Tiga Tipe D Pancoran Jakarta Selatan,Pancoran,K. Mandi Dalam ·WiFi ·AC ·Kloset Duduk ·Kasur ·Akses 24 Jam,Rp800.000
603,Kost Yustin Tipe F Pancoran Jakarta Selatan,Pancoran,K. Mandi Dalam ·WiFi ·AC ·Kloset Duduk ·Kasur ·Akses 24 Jam,Rp4.000.000
604,Kost Duren Tiga Tipe B Pancoran Jakarta Selatan,Pancoran,K. Mandi Dalam ·WiFi ·Kloset Duduk ·Kasur ·Akses 24 Jam,Rp4.500.000
605,Kost Murah Pasar Santa Kebayoran Baru Jakarta Selatan,Kecamatan Kebayoran Baru,K. Mandi Dalam ·AC ·Kloset Duduk ·Kasur ·Akses 24 Jam,Rp2.400.000
606,Kost Zarus 1 Mampang Prapatan Jakarta Selatan,Mampang Prapatan,K. Mandi Dalam ·WiFi ·Kloset Duduk ·Kasur ·Akses 24 Jam,Rp1.800.000
607,Kost Jasmine Tipe A Pancoran Jakarta Selatan,Pancoran,K. Mandi Dalam ·Kasur ·Akses 24 Jam,Rp2.100.000
608,Kost Wisma Kaesang Tipe A Mampang Prapatan Jakarta Selatan,Mampang Prapatan,"K. Mandi Dalam ·WiFi ·AC ·Kloset Duduk ·Kasur ·Akses 24 Jam
3.1",Rp2.500.000
609,Kost Achmad Saepudin I Tipe A Mampang Prapatan Jakarta Selatan,Kecamatan Mampang Prapatan,Akses 24 Jam,Rp1.250.000
610,Kost Rengas 2 Kebayoran Baru Jakarta Selatan,Kebayoran Baru,"K. Mandi Dalam ·WiFi ·Kasur
5.0",Rp1.800.000
611,Kost Infinite Residence Mampang Prapatan Jakarta Selatan,Mampang Prapatan,K. Mandi Dalam ·WiFi ·AC ·Kloset Duduk ·Kasur ·Akses 24 Jam,Rp1.300.000
612,Kost Kalibata Tipe 1 Pancoran Jakarta Selatan,Kecamatan Pancoran,K. Mandi Dalam ·WiFi ·AC ·Kloset Duduk ·Kasur ·Akses 24 Jam,Rp1.400.000
613,Kost Haji Edi Mampang Prapatan Jakarta Selatan,Kecamatan Mampang Prapatan,K. Mandi Dalam ·WiFi ·Kasur ·Akses 24 Jam,Rp1.700.000
614,Kost Amanina Tipe B Pancoran Jakarta Selatan,Pancoran,"K. Mandi Dalam ·WiFi ·Kloset Duduk ·Kasur
1.3",Rp750.000
615,Kost 55 Kalibata Tipe C Pancoran Jakarta Selatan,Kecamatan Pancoran,K. Mandi Dalam ·WiFi ·AC ·Kloset Duduk ·Kasur,Rp1.200.000
616,Kost 55 Kalibata Tipe B Pancoran Jakarta Selatan,Kecamatan Pancoran,"K. Mandi Dalam ·WiFi ·AC ·Kloset Duduk ·Kasur
3.6",Rp2.400.000
617,Kost Akanaka Residence Mampang Prapatan Jakarta Selatan,Mampang Prapatan,K. Mandi Dalam ·WiFi ·AC ·Kloset Duduk ·Kasur,Rp1.800.000
618,Kost Abdul Majid Urban Residence Deluxe Kebayoran Baru Jakarta Selatan,Kebayoran Baru,K. Mandi Dalam ·WiFi ·AC ·Kloset Duduk ·Kasur ·Akses 24 Jam,Rp2.100.000
619,Kost Giri Enam Home King Bed Balcony Lt 2 Kebayoran Baru Jakarta Selatan,Kecamatan Kebayoran Baru,K. Mandi Dalam ·WiFi ·AC ·Kloset Duduk ·Kasur ·Akses 24 Jam,Rp2.500.000
620,Kost Vera Norita Tipe A Pancoran Jakarta Selatan,Pancoran,K. Mandi Dalam ·WiFi ·AC ·Kasur,Rp1.250.000
621,Kost Andi Tipe A Pasar Minggu Jakarta Selatan,Pasar Minggu,K. Mandi Dalam ·Kloset Duduk,Rp1.800.000
622,Kost White Tipe B Mampang Prapatan Jakarta Selatan,Mampang Prapatan,K. Mandi Dalam ·WiFi ·Kloset Duduk ·Kasur ·Akses 24 Jam,Rp1.300.000
623,Kost Pak Choliq Tipe B Mampang Prapatan Jakarta Selatan,Kecamatan Mampang Prapatan,K. Mandi Dalam ·AC ·Kloset Duduk ·Kasur ·Akses 24 Jam,Rp1.400.000
624,Kost Ibu Fitri Mampang Prapatan Jakarta Selatan,Mampang Prapatan,K. Mandi Dalam ·Kasur ·Akses 24 Jam,Rp1.700.000
625,Kost Bang Bewok Tipe A Pancoran Jakarta Selatan,Kecamatan Pancoran,K. Mandi Dalam ·AC ·Kasur ·Akses 24 Jam,Rp750.000
626,Kost Sweet Home 1 Tipe D5 Pancoran Jakarta Selatan,Pancoran,K. Mandi Dalam ·AC ·Kasur ·Akses 24 Jam,Rp1.200.000
627,Kost Jazleen Tipe C Pancoran Jakarta Selatan,Pancoran,"WiFi ·Kloset Duduk ·Kasur
5.0",Rp4.000.000
628,Kost Sweet Home 1 Tipe E3 Pancoran Jakarta Selatan,Pancoran,K. Mandi Dalam ·AC ·Kasur ·Akses 24 Jam,Rp1.800.000
629,Kost Samali Tipe A Pasar Minggu Jakarta Selatan,Pasar Minggu,AC ·Kloset Duduk ·Akses 24 Jam,Rp1.300.000
630,Kost Edy Mampang Prapatan Jakarta Selatan,Kecamatan Mampang Prapatan,K. Mandi Dalam ·Kasur,Rp1.800.000
631,Kost Poncol Jaya Mampang Prapatan Jakarta Selatan,Mampang Prapatan,WiFi ·AC ·Kasur,Rp3.000.000
632,Kost Dewi Pancoran Jakarta Selatan,Pancoran,WiFi ·Kloset Duduk ·Kasur,Rp3.000.000
633,Kost Ibu Sudar Tipe A Mampang Prapatan Jakarta Selatan,Kecamatan Mampang Prapatan,WiFi ·AC ·Kloset Duduk ·Kasur,Rp5.000.000
634,Kost Pejaten Indah Pancoran Jakarta Selatan,Kecamatan Pancoran,"K. Mandi Dalam ·WiFi ·AC ·Kloset Duduk ·Kasur
5.0",Rp5.200.000
635,Kost Amiza Zulfi Mampang Prapatan Jakarta Selatan,Kecamatan Mampang Prapatan,"K. Mandi Dalam ·WiFi ·AC ·Kloset Duduk ·Kasur
3.9",Rp3.260.000
636,Kos faizah Pancoran Jakarta Selatan,Pancoran,K. Mandi Dalam ·WiFi ·AC ·Kloset Duduk ·Kasur ·Akses 24 Jam,Rp1.000.000
637,Kost Cipete 15 Cilandak Jakarta Selatan,Cilandak,K. Mandi Dalam ·WiFi ·AC ·Kloset Duduk ·Kasur,Rp1.500.000
638,Kost Aalaya 1 Mampang Prapatan Jakarta Selatan,Mampang Prapatan,K. Mandi Dalam ·WiFi ·AC ·Kloset Duduk ·Akses 24 Jam,Rp1.200.000
639,Kost Bangka BnB Tipe B Mampang Prapatan Jakarta Selatan,Kecamatan Mampang Prapatan,K. Mandi Dalam ·WiFi ·AC ·Kasur ·Akses 24 Jam,Rp1.500.000
640,Kost Singgahsini RR Mansion Tipe C Pancoran Jakarta Selatan,Pancoran,K. Mandi Dalam ·WiFi ·AC ·Kloset Duduk ·Kasur ·Akses 24 Jam,Rp1.000.000
641,Kost Singgahsini RR Mansion Tipe B Pancoran Jakarta Selatan,Pancoran,K. Mandi Dalam ·WiFi ·AC ·Kloset Duduk ·Kasur ·Akses 24 Jam,Rp1.200.000
642,Kost Singgahsini Nathan Kemang Utara Tipe D Mampang Prapatan Jakarta Selatan,Mampang Prapatan,K. Mandi Dalam ·WiFi ·AC ·Kloset Duduk ·Kasur ·Akses 24 Jam,Rp2.000.000
643,Kost Singgahsini RR Mansion Tipe A Pancoran Jakarta Selatan,Pancoran,K. Mandi Dalam ·WiFi ·AC ·Kloset Duduk ·Kasur ·Akses 24 Jam,Rp1.000.000
644,Kost Singgahsini Nathan Kemang Utara Tipe A Mampang Prapatan Jakarta Selatan,Mampang Prapatan,K. Mandi Dalam ·WiFi ·AC ·Kloset Duduk ·Kasur ·Akses 24 Jam,Rp2.000.000
645,Kost Singgahsini Vit Tipe B Mampang Prapatan Jakarta Selatan,Mampang Prapatan,K. Mandi Dalam ·WiFi ·AC ·Kloset Duduk ·Kasur ·Akses 24 Jam,Rp1.500.000
646,Kost Singgahsini Kemang 6 Tipe C Mampang Prapatan Jakarta Selatan,Mampang Prapatan,K. Mandi Dalam ·WiFi ·AC ·Kloset Duduk ·Kasur ·Akses 24 Jam,Rp1.225.000
647,Kost Singgahsini White House Tipe B Mampang Prapatan Jakarta Selatan,Kecamatan Mampang Prapatan,"K. Mandi Dalam ·WiFi ·AC ·Kloset Duduk ·Kasur ·Akses 24 Jam
4.6",Rp1.700.000
648,Kost Apik Pondok Jaya VIII Tipe D Mampang Prapatan Jakarta Selatan,Mampang Prapatan,WiFi ·Kloset Duduk ·Kasur ·Akses 24 Jam,Rp1.050.000
649,Kost Harum 1 Tipe A Kebayoran Baru Jakarta Selatan,Kecamatan Kebayoran Baru,"Kasur ·Akses 24 Jam
5.0",Rp2.000.000
650,Kost Pak Rahmani Pancoran Jakarta Selatan,Pancoran,K. Mandi Dalam ·WiFi ·Kasur ·Akses 24 Jam,Rp2.000.000
651,Kost 37 Syariah Tipe B Pancoran Jakarta Selatan,Pancoran,"K. Mandi Dalam ·Kloset Duduk ·Kasur ·Akses 24 Jam
3.3",Rp1.500.000
652,Kost Ceria Sekali Tipe A Mampang Prapatan Jakarta Selatan,Mampang Prapatan,"K. Mandi Dalam ·WiFi ·Kasur ·Akses 24 Jam
1.0",Rp1.500.000
653,Kost Arfath Pancoran Jakarta Selatan,Pancoran,K. Mandi Dalam ·WiFi ·AC ·Kloset Duduk ·Kasur ·Akses 24 Jam,Rp2.500.000
654,Kost Whites Tipe C Pancoran Jakarta Selatan,Kecamatan Pancoran,K. Mandi Dalam ·WiFi ·AC ·Kloset Duduk ·Kasur ·Akses 24 Jam,Rp3.000.000
655,Kost House Of Bless Tipe A Mampang Prapatan Jakarta Selatan,Kecamatan Mampang Prapatan,K. Mandi Dalam ·WiFi ·AC ·Kasur,Rp3.750.000
656,Kost Owen Tipe A Pancoran Jakarta Selatan,Pancoran,K. Mandi Dalam ·WiFi ·AC ·Kloset Duduk ·Kasur,Rp4.075.000
657,Kost Jabu Hasian Cipete Lt 2 Cilandak Jakarta Selatan,Kecamatan Cilandak,AC ·Kloset Duduk ·Kasur ·Akses 24 Jam,Rp4.275.000
658,Kost Soffiyan Mampang Prapatan Jakarta Selatan,Kecamatan Mampang Prapatan,K. Mandi Dalam ·WiFi ·AC ·Kasur ·Akses 24 Jam,Rp3.275.000
659,Kost Verdita I Cilandak Jakarta Selatan,Kecamatan Cilandak,K. Mandi Dalam ·WiFi ·AC ·Kloset Duduk ·Kasur ·Akses 24 Jam,Rp4.825.000
660,Kost Bapak Fikri Tipe B Pancoran Jakarta Selatan,Pancoran,"K. Mandi Dalam ·WiFi ·Kasur
1.6",Rp3.225.000
661,Kost Bapak Fikri Tipe A Pancoran Jakarta Selatan,Pancoran,K. Mandi Dalam ·WiFi ·Kasur,Rp3.625.000
662,Kost Ummi Tipe A2 Mampang Prapatan Jakarta Selatan,Kecamatan Mampang Prapatan,K. Mandi Dalam ·WiFi ·AC ·Kloset Duduk ·Kasur ·Akses 24 Jam,Rp2.875.000
663,Kost Mroom Nipah Residence Tipe B Kebayoran Baru Jakarta Selatan,Kecamatan Kebayoran Baru,K. Mandi Dalam ·WiFi ·AC ·Kloset Duduk ·Kasur ·Akses 24 Jam,Ngekos di SS SatSet Gak Macet
664,Kost Ani 3 Pancoran Jakarta Selatan,Kecamatan Pancoran,K. Mandi Dalam ·WiFi ·AC ·Kasur ·Akses 24 Jam,Rp2.805.000
665,Kost Pondok VIP Mampang Prapatan Jakarta Selatan,Kecamatan Mampang Prapatan,K. Mandi Dalam ·WiFi ·AC ·Kloset Duduk ·Kasur ·Akses 24 Jam,Rp1.650.000
666,Kost Young Tipe B Pancoran Jakarta Selatan,Kecamatan Pancoran,K. Mandi Dalam ·WiFi ·AC ·Kloset Duduk ·Kasur,Rp650.000
667,Kost Omah Tentrem Wijaya Tipe Single Bed Kebayoran Baru Jakarta Selatan,Kebayoran Baru,K. Mandi Dalam ·WiFi ·AC ·Kloset Duduk ·Kasur,Rp1.100.000
668,Kost Chie 88 Mampang Prapatan Jakarta Selatan,Kecamatan Mampang Prapatan,K. Mandi Dalam ·Akses 24 Jam,Rp1.300.000
669,Kost Salamah Mampang Prapatan Jakarta Selatan,Mampang Prapatan,K. Mandi Dalam ·WiFi ·AC ·Kasur ·Akses 24 Jam,Rp1.500.000
670,Kost Ibu Ida RW Pancoran Jakarta Selatan,Kecamatan Pancoran,Kloset Duduk ·Kasur ·Akses 24 Jam,Rp1.500.000
671,Kost Pa Yudi 1 Mampang Prapatan Jakarta Selatan,Kecamatan Mampang Prapatan,K. Mandi Dalam ·WiFi ·AC ·Kloset Duduk ·Akses 24 Jam,Rp2.500.000
672,Kost Arraihan Mampang Prapatan Jakarta Selatan,Kecamatan Mampang Prapatan,Kasur ·Akses 24 Jam,Rp2.750.000
673,Kost Bangka Raya Tipe A Mampang Prapatan Jakarta Selatan,Mampang Prapatan,K. Mandi Dalam ·WiFi ·AC ·Kloset Duduk ·Kasur ·Akses 24 Jam,Rp2.400.000
674,Kost Mp Prapatan Mpok Iyah Mampang Prapatan Jakarta Selatan,Mampang Prapatan,K. Mandi Dalam ·Kloset Duduk,Rp3.500.000
675,Kost Bagus Pak Sobar Mampang Prapatan Jakarta Selatan,Mampang Prapatan,WiFi ·Kloset Duduk ·Kasur ·Akses 24 Jam,Rp1.500.000
676,Kost BG 2 Tipe B Pancoran Jakarta Selatan,Pancoran,K. Mandi Dalam ·WiFi ·AC ·Kasur ·Akses 24 Jam,Rp3.000.000
677,Kost Kapten Tendean Mampang Prapatan Jakarta Selatan,Mampang Prapatan,K. Mandi Dalam ·WiFi ·AC ·Kloset Duduk ·Kasur ·Akses 24 Jam,Rp850.000
678,Kost Haji Ayyub Tipe B Mampang Prapatan Jakarta Selatan,Kecamatan Mampang Prapatan,K. Mandi Dalam ·WiFi ·AC ·Kasur,Rp750.000
679,Kost Mandiri Satu Pancoran Jakarta Selatan,Kecamatan Pancoran,K. Mandi Dalam ·WiFi ·Kloset Duduk ·Kasur ·Akses 24 Jam,Rp1.800.000
680,Kost Mroom Nipah Residence Tipe B Kebayoran Baru Jakarta Selatan,Kecamatan Kebayoran Baru,K. Mandi Dalam ·WiFi ·AC ·Kloset Duduk ·Kasur ·Akses 24 Jam,Rp2.500.000
681,Kost Ani 3 Pancoran Jakarta Selatan,Kecamatan Pancoran,K. Mandi Dalam ·WiFi ·AC ·Kasur ·Akses 24 Jam,Rp1.400.000
682,Kost Pondok VIP Mampang Prapatan Jakarta Selatan,Kecamatan Mampang Prapatan,K. Mandi Dalam ·WiFi ·AC ·Kloset Duduk ·Kasur ·Akses 24 Jam,Rp2.000.000
683,Kost Young Tipe B Pancoran Jakarta Selatan,Kecamatan Pancoran,K. Mandi Dalam ·WiFi ·AC ·Kloset Duduk ·Kasur,Rp1.850.000
684,Kost Omah Tentrem Wijaya Tipe Single Bed Kebayoran Baru Jakarta Selatan,Kebayoran Baru,K. Mandi Dalam ·WiFi ·AC ·Kloset Duduk ·Kasur,Rp2.900.000
685,Kost Chie 88 Mampang Prapatan Jakarta Selatan,Kecamatan Mampang Prapatan,K. Mandi Dalam ·Akses 24 Jam,Rp1.370.000
686,Kost Salamah Mampang Prapatan Jakarta Selatan,Mampang Prapatan,K. Mandi Dalam ·WiFi ·AC ·Kasur ·Akses 24 Jam,Rp1.400.000
687,Kost Ibu Ida RW Pancoran Jakarta Selatan,Kecamatan Pancoran,Kloset Duduk ·Kasur ·Akses 24 Jam,Rp900.000
688,Kost Pa Yudi 1 Mampang Prapatan Jakarta Selatan,Kecamatan Mampang Prapatan,K. Mandi Dalam ·WiFi ·AC ·Kloset Duduk ·Akses 24 Jam,Rp1.600.000
689,Kost Arraihan Mampang Prapatan Jakarta Selatan,Kecamatan Mampang Prapatan,Kasur ·Akses 24 Jam,Rp800.000
690,Kost Bangka Raya Tipe A Mampang Prapatan Jakarta Selatan,Mampang Prapatan,K. Mandi Dalam ·WiFi ·AC ·Kloset Duduk ·Kasur ·Akses 24 Jam,Rp2.350.000
691,Kost Mp Prapatan Mpok Iyah Mampang Prapatan Jakarta Selatan,Mampang Prapatan,K. Mandi Dalam ·Kloset Duduk,Rp800.000
692,Kost Bagus Pak Sobar Mampang Prapatan Jakarta Selatan,Mampang Prapatan,WiFi ·Kloset Duduk ·Kasur ·Akses 24 Jam,Rp850.000
693,Kost BG 2 Tipe B Pancoran Jakarta Selatan,Pancoran,K. Mandi Dalam ·WiFi ·AC ·Kasur ·Akses 24 Jam,Rp1.500.000
694,Kost Kapten Tendean Mampang Prapatan Jakarta Selatan,Mampang Prapatan,K. Mandi Dalam ·WiFi ·AC ·Kloset Duduk ·Kasur ·Akses 24 Jam,Rp1.900.000
695,Kost Haji Ayyub Tipe B Mampang Prapatan Jakarta Selatan,Kecamatan Mampang Prapatan,K. Mandi Dalam ·WiFi ·AC ·Kasur,Rp1.300.000
696,Kost Mandiri Satu Pancoran Jakarta Selatan,Kecamatan Pancoran,K. Mandi Dalam ·WiFi ·Kloset Duduk ·Kasur ·Akses 24 Jam,Rp950.000
697,Kost Mroom Nipah Residence Tipe A Kebayoran Baru Jakarta Selatan,Kecamatan Kebayoran Baru,K. Mandi Dalam ·WiFi ·AC ·Kloset Duduk ·Kasur ·Akses 24 Jam,Rp2.500.000
698,Kost Encuk Jalu Mampang Prapatan Jakarta Selatan,Kecamatan Mampang Prapatan,K. Mandi Dalam ·WiFi ·Kasur ·Akses 24 Jam,Rp1.400.000
699,Kost Bapak Abdul Wahab Tipe A Mampang Prapatan Jakarta Selatan,Kecamatan Mampang Prapatan,K. Mandi Dalam ·AC ·Kasur ·Akses 24 Jam,Rp2.000.000
700,Kost Edy Mampang Prapatan Jakarta Selatan,Kecamatan Mampang Prapatan,K. Mandi Dalam ·Kasur,Rp1.850.000
701,Kost Poncol Jaya Mampang Prapatan Jakarta Selatan,Mampang Prapatan,WiFi ·AC ·Kasur,Rp2.900.000
702,Kost Dewi Pancoran Jakarta Selatan,Pancoran,WiFi ·Kloset Duduk ·Kasur,Rp1.370.000
703,Kost Ibu Sudar Tipe A Mampang Prapatan Jakarta Selatan,Kecamatan Mampang Prapatan,WiFi ·AC ·Kloset Duduk ·Kasur,Rp1.400.000
704,Kost Pejaten Indah Pancoran Jakarta Selatan,Kecamatan Pancoran,"K. Mandi Dalam ·WiFi ·AC ·Kloset Duduk ·Kasur
5.0",Rp900.000
705,Kost Amiza Zulfi Mampang Prapatan Jakarta Selatan,Kecamatan Mampang Prapatan,"K. Mandi Dalam ·WiFi ·AC ·Kloset Duduk ·Kasur
3.9",Rp1.600.000
706,Kos faizah Pancoran Jakarta Selatan,Pancoran,K. Mandi Dalam ·WiFi ·AC ·Kloset Duduk ·Kasur ·Akses 24 Jam,Rp800.000
707,Kost Cipete 15 Cilandak Jakarta Selatan,Cilandak,K. Mandi Dalam ·WiFi ·AC ·Kloset Duduk ·Kasur,Rp2.350.000
708,Kost Aalaya 1 Mampang Prapatan Jakarta Selatan,Mampang Prapatan,K. Mandi Dalam ·WiFi ·AC ·Kloset Duduk ·Akses 24 Jam,Rp800.000
709,Kost Bangka BnB Tipe B Mampang Prapatan Jakarta Selatan,Kecamatan Mampang Prapatan,K. Mandi Dalam ·WiFi ·AC ·Kasur ·Akses 24 Jam,Rp850.000
710,Kost Ibu Romlah Mampang Prapatan Jakarta Selatan,Mampang Prapatan,K. Mandi Dalam ·Kasur ·Akses 24 Jam,Rp1.500.000
711,Kost Ibu DS Tipe C Mampang Prapatan Jakarta Selatan,Kecamatan Mampang Prapatan,WiFi ·Kasur,Rp1.900.000
712,Kost Ibu Indah Executive Pancoran Jakarta Selatan,Pancoran,K. Mandi Dalam ·WiFi ·AC ·Kloset Duduk ·Kasur ·Akses 24 Jam,Rp1.300.000
713,Kost Dedy Tipe A Pancoran Jakarta Selatan,Kecamatan Pancoran,K. Mandi Dalam ·Kloset Duduk ·Kasur,Rp950.000
714,Kost Rumah Amel Tipe AC Pasar Minggu Jakarta Selatan,Pasar Minggu,K. Mandi Dalam ·WiFi ·AC ·Kasur ·Akses 24 Jam,Rp2.700.000
715,Kost Dizmizz Kebayoran Baru Jakarta Selatan,Kecamatan Kebayoran Baru,WiFi ·Kloset Duduk ·Kasur ·Akses 24 Jam,Rp900.000
716,Kost Kebalen 1 Tipe A Kebayoran Baru Jakarta Selatan,Kebayoran Baru,K. Mandi Dalam ·AC ·Kloset Duduk ·Kasur ·Akses 24 Jam,Rp1.200.000
717,Kost Darmani Kebayoran Baru Jakarta Selatan,Kebayoran Baru,K. Mandi Dalam ·WiFi ·Kasur,Rp1.225.000
718,Kost Rumah Amel Executive Pasar Minggu Jakarta Selatan,Pasar Minggu,K. Mandi Dalam ·WiFi ·AC ·Kasur ·Akses 24 Jam,Rp1.700.000
719,Kost Barakah Dua Mampang Prapatan Jakarta Selatan,Kecamatan Mampang Prapatan,K. Mandi Dalam ·AC ·Kasur,Rp1.050.000
720,Kost Amy 36 Tipe C Mampang Prapatan Jakarta Selatan,Mampang Prapatan,K. Mandi Dalam ·WiFi ·AC ·Kloset Duduk ·Kasur ·Akses 24 Jam,Rp2.000.000
721,Kost Kemang Utara C Mampang Prapatan Jakarta Selatan,Kecamatan Mampang Prapatan,AC ·Kloset Duduk ·Kasur ·Akses 24 Jam,Rp2.000.000
722,Kost Daksa Pancoran Jakarta Selatan,Pancoran,"Kloset Duduk ·Kasur
4.6",Rp1.500.000
723,Kost H Deddy Tipe A Mampang Prapatan Jakarta Selatan,Kecamatan Mampang Prapatan,K. Mandi Dalam ·Kasur ·Akses 24 Jam,Rp1.500.000
724,Kost 3 Pav Pancoran Jakarta Selatan,Pancoran,K. Mandi Dalam ·WiFi ·AC ·Kloset Duduk ·Kasur ·Akses 24 Jam,Rp2.500.000
725,Kost Dahlia Pasar Minggu Jakarta Selatan,Pasar Minggu,K. Mandi Dalam ·WiFi ·Kasur ·Akses 24 Jam,Rp3.000.000
726,Kost Bengisel Tipe A Pancoran Jakarta Selatan,Pancoran,"WiFi ·Kloset Duduk ·Kasur ·Akses 24 Jam
4.5",Rp3.750.000
727,Kost Almuntaha Tipe Duluxe Mampang Prapatan Jakarta Selatan,Kecamatan Mampang Prapatan,"K. Mandi Dalam ·WiFi ·AC ·Kloset Duduk ·Kasur ·Akses 24 Jam
5.0",Rp900.000
728,Kost Triloka Mansion Tipe C Pancoran Jakarta Selatan,Pancoran,K. Mandi Dalam ·WiFi ·AC ·Kloset Duduk ·Kasur ·Akses 24 Jam,Rp900.000
729,Kost Nabils Mampang Prapatan Jakarta Selatan,Mampang Prapatan,K. Mandi Dalam ·WiFi ·AC ·Kloset Duduk ·Kasur,Rp1.650.000
730,Kost Nur 53 AC Mampang Prapatan Jakarta Selatan,Kecamatan Mampang Prapatan,"WiFi ·AC ·Kloset Duduk ·Kasur ·Akses 24 Jam
4.6",Rp850.000
731,Kost 88 Group Tipe A Pancoran Jakarta Selatan,Kecamatan Pancoran,K. Mandi Dalam ·WiFi ·AC ·Kloset Duduk ·Kasur ·Akses 24 Jam,Rp1.500.000
732,Kost Triloka Mansion Tipe B Pancoran Jakarta Selatan,Pancoran,"K. Mandi Dalam ·WiFi ·AC ·Kloset Duduk ·Kasur ·Akses 24 Jam
4.0",Rp1.100.000
733,Kost Happy Family Tipe A Mampang Prapatan Jakarta Selatan,Kecamatan Mampang Prapatan,"K. Mandi Dalam ·WiFi ·Kloset Duduk ·Kasur ·Akses 24 Jam
5.0",Rp2.200.000
734,Kost Bapak Fikri Tipe B Pancoran Jakarta Selatan,Pancoran,"K. Mandi Dalam ·WiFi ·Kasur
1.6",Rp1.100.000
735,Kost Bapak Fikri Tipe A Pancoran Jakarta Selatan,Pancoran,K. Mandi Dalam ·WiFi ·Kasur,Rp2.250.000
736,Kost Ummi Tipe A2 Mampang Prapatan Jakarta Selatan,Kecamatan Mampang Prapatan,K. Mandi Dalam ·WiFi ·AC ·Kloset Duduk ·Kasur ·Akses 24 Jam,Rp1.300.000
737,Kost Mroom Nipah Residence Tipe B Kebayoran Baru Jakarta Selatan,Kecamatan Kebayoran Baru,K. Mandi Dalam ·WiFi ·AC ·Kloset Duduk ·Kasur ·Akses 24 Jam,Rp2.450.000
738,Kost Ani 3 Pancoran Jakarta Selatan,Kecamatan Pancoran,K. Mandi Dalam ·WiFi ·AC ·Kasur ·Akses 24 Jam,Rp1.300.000
739,Kost Pondok VIP Mampang Prapatan Jakarta Selatan,Kecamatan Mampang Prapatan,K. Mandi Dalam ·WiFi ·AC ·Kloset Duduk ·Kasur ·Akses 24 Jam,Rp1.150.000
740,Kost Andi Tipe A Pasar Minggu Jakarta Selatan,Pasar Minggu,K. Mandi Dalam ·Kloset Duduk,Rp900.000
741,Kost White Tipe B Mampang Prapatan Jakarta Selatan,Mampang Prapatan,K. Mandi Dalam ·WiFi ·Kloset Duduk ·Kasur ·Akses 24 Jam,Rp2.000.000
742,Kost Pak Choliq Tipe B Mampang Prapatan Jakarta Selatan,Kecamatan Mampang Prapatan,K. Mandi Dalam ·AC ·Kloset Duduk ·Kasur ·Akses 24 Jam,Rp900.000
743,Kost Ibu Fitri Mampang Prapatan Jakarta Selatan,Mampang Prapatan,K. Mandi Dalam ·Kasur ·Akses 24 Jam,Rp1.000.000
744,Kost Bang Bewok Tipe A Pancoran Jakarta Selatan,Kecamatan Pancoran,K. Mandi Dalam ·AC ·Kasur ·Akses 24 Jam,Rp3.500.000
745,Kost Sweet Home 1 Tipe D5 Pancoran Jakarta Selatan,Pancoran,K. Mandi Dalam ·AC ·Kasur ·Akses 24 Jam,Rp2.650.000
746,Kost Jazleen Tipe C Pancoran Jakarta Selatan,Pancoran,"WiFi ·Kloset Duduk ·Kasur
5.0",Rp1.700.000
747,Kost Sweet Home 1 Tipe E3 Pancoran Jakarta Selatan,Pancoran,K. Mandi Dalam ·AC ·Kasur ·Akses 24 Jam,Rp1.500.000
748,Kost Samali Tipe A Pasar Minggu Jakarta Selatan,Pasar Minggu,AC ·Kloset Duduk ·Akses 24 Jam,Rp1.800.000
749,Kost Edy Mampang Prapatan Jakarta Selatan,Kecamatan Mampang Prapatan,K. Mandi Dalam ·Kasur,Rp2.840.000
750,Kost Poncol Jaya Mampang Prapatan Jakarta Selatan,Mampang Prapatan,WiFi ·AC ·Kasur,Rp1.300.000
751,Kost Dewi Pancoran Jakarta Selatan,Pancoran,WiFi ·Kloset Duduk ·Kasur,Rp850.000
752,Kost Ibu Sudar Tipe A Mampang Prapatan Jakarta Selatan,Kecamatan Mampang Prapatan,WiFi ·AC ·Kloset Duduk ·Kasur,Rp750.000
753,Kost Pejaten Indah Pancoran Jakarta Selatan,Kecamatan Pancoran,"K. Mandi Dalam ·WiFi ·AC ·Kloset Duduk ·Kasur
5.0",Rp1.800.000
754,Kost Amiza Zulfi Mampang Prapatan Jakarta Selatan,Kecamatan Mampang Prapatan,"K. Mandi Dalam ·WiFi ·AC ·Kloset Duduk ·Kasur
3.9",Rp2.500.000
755,Kos faizah Pancoran Jakarta Selatan,Pancoran,K. Mandi Dalam ·WiFi ·AC ·Kloset Duduk ·Kasur ·Akses 24 Jam,Rp1.400.000
756,Kost Cipete 15 Cilandak Jakarta Selatan,Cilandak,K. Mandi Dalam ·WiFi ·AC ·Kloset Duduk ·Kasur,Rp2.000.000
757,Kost Aalaya 1 Mampang Prapatan Jakarta Selatan,Mampang Prapatan,K. Mandi Dalam ·WiFi ·AC ·Kloset Duduk ·Akses 24 Jam,Rp1.500.000
758,Kost Bangka BnB Tipe B Mampang Prapatan Jakarta Selatan,Kecamatan Mampang Prapatan,K. Mandi Dalam ·WiFi ·AC ·Kasur ·Akses 24 Jam,Rp1.200.000
759,Kost Ibu Romlah Mampang Prapatan Jakarta Selatan,Mampang Prapatan,K. Mandi Dalam ·Kasur ·Akses 24 Jam,Rp1.500.000
760,Kost Ani 3 Pancoran Jakarta Selatan,Kecamatan Pancoran,K. Mandi Dalam ·WiFi ·AC ·Kasur ·Akses 24 Jam,Rp1.000.000
761,Kost Pondok VIP Mampang Prapatan Jakarta Selatan,Kecamatan Mampang Prapatan,K. Mandi Dalam ·WiFi ·AC ·Kloset Duduk ·Kasur ·Akses 24 Jam,Rp1.200.000
762,Kost Young Tipe B Pancoran Jakarta Selatan,Kecamatan Pancoran,K. Mandi Dalam ·WiFi ·AC ·Kloset Duduk ·Kasur,Rp2.000.000
763,Kost Omah Tentrem Wijaya Tipe Single Bed Kebayoran Baru Jakarta Selatan,Kebayoran Baru,K. Mandi Dalam ·WiFi ·AC ·Kloset Duduk ·Kasur,Rp1.000.000
764,Kost Chie 88 Mampang Prapatan Jakarta Selatan,Kecamatan Mampang Prapatan,K. Mandi Dalam ·Akses 24 Jam,Rp2.000.000
765,Kost Salamah Mampang Prapatan Jakarta Selatan,Mampang Prapatan,K. Mandi Dalam ·WiFi ·AC ·Kasur ·Akses 24 Jam,Rp1.500.000
766,Kost Ibu Ida RW Pancoran Jakarta Selatan,Kecamatan Pancoran,Kloset Duduk ·Kasur ·Akses 24 Jam,Rp1.225.000
767,Kost Pa Yudi 1 Mampang Prapatan Jakarta Selatan,Kecamatan Mampang Prapatan,K. Mandi Dalam ·WiFi ·AC ·Kloset Duduk ·Akses 24 Jam,Rp1.700.000
768,Kost Arraihan Mampang Prapatan Jakarta Selatan,Kecamatan Mampang Prapatan,Kasur ·Akses 24 Jam,Rp1.050.000
769,Kost Bangka Raya Tipe A Mampang Prapatan Jakarta Selatan,Mampang Prapatan,K. Mandi Dalam ·WiFi ·AC ·Kloset Duduk ·Kasur ·Akses 24 Jam,Rp2.000.000
770,Kost Mp Prapatan Mpok Iyah Mampang Prapatan Jakarta Selatan,Mampang Prapatan,K. Mandi Dalam ·Kloset Duduk,Rp2.000.000
771,Kost Bagus Pak Sobar Mampang Prapatan Jakarta Selatan,Mampang Prapatan,WiFi ·Kloset Duduk ·Kasur ·Akses 24 Jam,Rp1.500.000
